{
  "schemaVersion": "1.0",
  "schema": "references/report-output-release.schema.json",
  "status": "approved",
  "releasedAt": "2026-10-27T15:28:08+10:30",
  "implementationHead": "79e90cad0abeb7042ba1d0b27efa1d78d35cd4b7",
  "provenance": {
    "upstreamRepository": "https://github.com/ZeroxZhang/zerox-skills.git",
    "upstreamCommit": "ee1f980c8dd7c53408e1a05a084229e6ec03c660",
    "composerReferenceCommit": "bfef13d",
    "finalBenchmarkIntegrityCommit": "79e90cad0abeb7042ba1d0b27efa1d78d35cd4b7",
    "a4ApprovalCommit": "e6017d2883c425fe85da49c6933a940f4e07725f"
  },
  "capabilities": {
    "matrix": "references/upstream-capability-matrix.json",
    "requiredCount": 26,
    "allowedStatuses": [
      "parity",
      "superseded"
    ],
    "forbiddenStatuses": [
      "missing",
      "untested",
      "present-not-used"
    ],
    "strictCheck": "passed"
  },
  "evidence": {
    "deckScorecard": {
      "path": "references/release-evidence/deck-scorecard.json",
      "sha256": "9f062757945d1ec3ae99c1599268c5061223ee149ba352873ff5f8c790dbba12"
    },
    "deckReveal": {
      "path": "references/release-evidence/deck-reveal.json",
      "sha256": "db71c208d427c2dc552af3adc16b5d5e6fd3917711f7694c0eabd3b4a67d7f8b"
    },
    "deckArtifacts": {
      "path": "references/release-evidence/deck-artifacts.json",
      "sha256": "8ecb007cca301a4d573196481f16d000ffbea0b72ee4a87d22bfe6fb5ce5e014"
    },
    "a4Evidence": {
      "path": "references/release-evidence/a4-evidence.json",
      "sha256": "db9af2ed01633bae9058c1f002907dd33892a399d0e480650027e780115ea712"
    },
    "scenarioTests": {
      "path": "references/release-evidence/scenario-tests.json",
      "sha256": "70a28d5207a1665842a5342af15501cc5c52722142f70ee7ae4050f4f33a8ab7"
    }
  },
  "a4": {
    "status": "approved",
    "candidateDigest": "f2f2c00c81b58e7043932e1b6fc85ad90df6ebff3e454a5c2f370b823baaf841",
    "approvedBy": "user",
    "approvedAt": "2026-10-27T17:30:00+10:30",
    "approvalReason": "Task 4：正文来源带改为 appendix-linked citation markers；逐页与 contact sheet 已检查",
    "baselineManifest": "references/release-evidence/a4-user-approved-baseline.json",
    "baselineManifestSha256": "705ab157221f92c0a02b65e841552a496739c2c3c276938badbe3dc6946a0250",
    "reviewManifest": "references/release-evidence/a4-evidence.json",
    "reviewManifestSha256": "db9af2ed01633bae9058c1f002907dd33892a399d0e480650027e780115ea712",
    "pageCount": 16,
    "contactSheetCount": 5,
    "scores": {
      "visual_focus": 5,
      "evidence_geometry": 5,
      "density": 4,
      "typography": 5,
      "chart_clarity": 5,
      "book_rhythm": 5,
      "source_integration": 5,
      "finish": 4
    }
  },
  "deck": {
    "status": "approved",
    "reviewPacket": "references/release-evidence/deck-artifacts.json",
    "rebuildConfig": "out-deck/benchmarks/semantic-benchmark.json",
    "rebuildConfigSha256": "773a3d4a14751f658af3e5b6398ba74290665e9e27eb1e5fcfd61709542534ef",
    "anonymousManifestSha256": "bb4a92a84c38171aec1366b8c3f39c8b607138d584fee55d1c67c86afc93c7fe",
    "inputSha256": "8c042d0c6a58263ec2f8365fcf56235dbc81a58539f30c24b51ebaf874e9bec8",
    "blueprintSha256": "e906c7ee1148ecca2a8dc89381ba0688f6d927b111961eea6da3c27340abfafc",
    "candidateLabel": "Cinder",
    "referenceLabel": "Willow",
    "passingLabel": "Cinder",
    "scoreThreshold": 4,
    "candidatePdfSha256": "43151ae96ca7fcfbbd1ab6d420368698d0a1cf1b646ef3dfb8cb728c82f317b6",
    "candidateCrossMediaSha256": "0d8046af8e2fdde9d425d9fb178edfcfdad3a1548578cbebf47634f5ae6ab5dd",
    "candidateScores": {
      "visual_focus": 4,
      "evidence_geometry": 5,
      "density": 4,
      "typography": 4,
      "chart_clarity": 5,
      "book_rhythm": 5,
      "source_integration": 5,
      "finish": 4
    },
    "referenceScores": {
      "visual_focus": 4,
      "evidence_geometry": 4,
      "density": 4,
      "typography": 4,
      "chart_clarity": 5,
      "book_rhythm": 4,
      "source_integration": 4,
      "finish": 4
    },
    "winningDimensions": [
      "evidence_geometry",
      "book_rhythm",
      "source_integration"
    ],
    "tiedDimensions": [
      "visual_focus",
      "density",
      "typography",
      "chart_clarity",
      "finish"
    ],
    "losingDimensions": [],
    "noWorse": true,
    "blockers": [],
    "qa": {
      "candidateAcceptance": true,
      "referenceAcceptance": true,
      "candidateGeometry": "PASS",
      "referenceGeometry": "PASS",
      "candidateErrors": 0,
      "referenceErrors": 0,
      "htmlPages": 5,
      "pdfPages": 5,
      "crossMediaTextSimilarity": 1
    },
    "reviewer": {
      "mode": "fresh-read-only-anonymous",
      "identityAvailableDuringScoring": false,
      "sourceCodeAvailableDuringScoring": false,
      "priorPacketsAvailableDuringScoring": false
    }
  },
  "scenarios": {
    "manifest": "tests/report-output-cases.json",
    "manifestSha256": "7338683c34096718e70119d30a14e2de8b4e935958a7597d2ea6a676fee8ae88",
    "positiveCases": 6,
    "negativeCases": 6,
    "missingReviewFailureClosed": true,
    "e2eResult": "passed"
  },
  "verification": {
    "commands": [
      {
        "command": "python3 tools/report_capabilities.py check --strict",
        "result": "passed",
        "summary": "0 errors; strict=true"
      },
      {
        "command": "ALLEN_RUNTIME=${ALLEN_RUNTIME:?set installed runtime} ALLEN_REQUIRE_TOOLS=1 python3 -m unittest discover -s out-deck/scripts/tests -t out-deck/scripts/tests",
        "result": "passed",
        "summary": "25/25"
      },
      {
        "command": "ALLEN_RUNTIME=${ALLEN_RUNTIME:?set installed runtime} ALLEN_REQUIRE_TOOLS=1 python3 -m unittest discover -s out-report/scripts/tests -t out-report/scripts/tests",
        "result": "passed",
        "summary": "133/133"
      },
      {
        "command": "ALLEN_RUNTIME=${ALLEN_RUNTIME:?set installed runtime} python3 -m unittest discover -s tools/tests/e2e -t tools/tests/e2e",
        "result": "passed",
        "summary": "7/7 smoke and consulting paths"
      },
      {
        "command": "ALLEN_RUNTIME=${ALLEN_RUNTIME:?set installed runtime} ./tools/selftest.sh --quick",
        "result": "passed",
        "summary": "tools 299; core-diligence 44; core-intake 16; core-research 48; core-storyline 32; out-chart 5; out-deck 25; out-poster 4; out-report 133"
      },
      {
        "command": "python3 tools/validate.py",
        "result": "passed",
        "summary": "0 errors; 3 pre-existing hints"
      },
      {
        "command": "python3 tools/report_release.py check",
        "result": "passed",
        "summary": "release evidence and provenance checks passed"
      },
      {
        "command": "python3 tools/build-zips.py",
        "result": "passed",
        "summary": "23 skill archives built"
      },
      {
        "command": "git diff --check",
        "result": "passed",
        "summary": "no whitespace errors"
      }
    ],
    "allPassed": true,
    "knownNonblockingHints": [
      "tools/validate.py reports three pre-existing method-card source hints"
    ]
  },
  "review": "docs/reviews/report-output-visual-acceptance.md"
}
